{
  "$schema": "../../schemas/v1/creature.schema.json",
  "id": "wolven_hunter",
  "name": "Wolven Hunter",
  "rank": 2,
  "description": "Hunter unit that fires powerful long-range bolts",
  "stats": {
    "health": 340,
    "speed": 3,
    "dps": 16,
    "range": 75,
    "hps": 0
  },
  "tags": [],
  "meta": {
    "source": "Spellcasters.md migration"
  },
  "date_modified": "2026-02-03T01:54:09.601146Z",
  "version": "1.0.1",
  "type": "Unknown"
}