{
  "$schema": "../../schemas/v1/creature.schema.json",
  "id": "lizard_archer",
  "name": "Lizard Archer",
  "rank": 1,
  "description": "Long-range fighter that deals bonus damage to flying enemies",
  "stats": {
    "health": 85,
    "speed": 3,
    "dps": 8,
    "range": 35,
    "hps": 0
  },
  "tags": [],
  "meta": {
    "source": "Spellcasters.md migration"
  },
  "date_modified": "2026-02-03T01:54:09.599150Z",
  "version": "1.0.1",
  "type": "Unknown"
}